{
  "schema": "classgroups/1",
  "generated_by": "8672b2d",
  "params": {"prime_pool_bound": 200, "disc_bound": 20000, "max_t": 4, "residue_class": "1 mod 4", "n_discriminants": 279},
  "aggregate": {"all_4rank_match": true, "strata": {"r4_0": 172, "r4_1": 103, "r4_ge2": 4}, "negative_pell_count": 199, "negative_pell_fraction": 0.713262},
  "discriminants": [
    {"D": 5, "t": 1, "h_narrow": 1, "h_ordinary": 1, "rank2": 0, "rank4_form": 0, "rank4_link": 0, "match": true, "pell_neg": true, "invariants": []},
    {"D": 65, "t": 2, "h_narrow": 2, "h_ordinary": 2, "rank2": 1, "rank4_form": 0, "rank4_link": 0, "match": true, "pell_neg": true, "invariants": [2]},
    {"D": 1105, "t": 3, "h_narrow": 4, "h_ordinary": 4, "rank2": 2, "rank4_form": 0, "rank4_link": 0, "match": true, "pell_neg": true, "invariants": [2,2]},
    {"D": 1885, "t": 3, "h_narrow": 8, "h_ordinary": 4, "rank2": 2, "rank4_form": 1, "rank4_link": 1, "match": true, "pell_neg": false, "invariants": [2,4]},
    {"D": 2405, "t": 3, "h_narrow": 4, "h_ordinary": 4, "rank2": 2, "rank4_form": 0, "rank4_link": 0, "match": true, "pell_neg": true, "invariants": [2,2]},
    {"D": 2665, "t": 3, "h_narrow": 4, "h_ordinary": 4, "rank2": 2, "rank4_form": 0, "rank4_link": 0, "match": true, "pell_neg": true, "invariants": [2,2]},
    {"D": 3445, "t": 3, "h_narrow": 4, "h_ordinary": 4, "rank2": 2, "rank4_form": 0, "rank4_link": 0, "match": true, "pell_neg": true, "invariants": [2,2]},
    {"D": 3965, "t": 3, "h_narrow": 8, "h_ordinary": 4, "rank2": 2, "rank4_form": 1, "rank4_link": 1, "match": true, "pell_neg": false, "invariants": [2,4]},
    {"D": 4745, "t": 3, "h_narrow": 4, "h_ordinary": 4, "rank2": 2, "rank4_form": 0, "rank4_link": 0, "match": true, "pell_neg": true, "invariants": [2,2]},
    {"D": 5785, "t": 3, "h_narrow": 4, "h_ordinary": 4, "rank2": 2, "rank4_form": 0, "rank4_link": 0, "match": true, "pell_neg": true, "invariants": [2,2]},
    {"D": 6305, "t": 3, "h_narrow": 4, "h_ordinary": 4, "rank2": 2, "rank4_form": 0, "rank4_link": 0, "match": true, "pell_neg": true, "invariants": [2,2]},
    {"D": 6565, "t": 3, "h_narrow": 8, "h_ordinary": 8, "rank2": 2, "rank4_form": 1, "rank4_link": 1, "match": true, "pell_neg": true, "invariants": [2,4]},
    {"D": 7085, "t": 3, "h_narrow": 4, "h_ordinary": 4, "rank2": 2, "rank4_form": 0, "rank4_link": 0, "match": true, "pell_neg": true, "invariants": [2,2]},
    {"D": 7345, "t": 3, "h_narrow": 4, "h_ordinary": 4, "rank2": 2, "rank4_form": 0, "rank4_link": 0, "match": true, "pell_neg": true, "invariants": [2,2]},
    {"D": 8905, "t": 3, "h_narrow": 12, "h_ordinary": 12, "rank2": 2, "rank4_form": 0, "rank4_link": 0, "match": true, "pell_neg": true, "invariants": [2,6]},
    {"D": 9685, "t": 3, "h_narrow": 4, "h_ordinary": 4, "rank2": 2, "rank4_form": 0, "rank4_link": 0, "match": true, "pell_neg": true, "invariants": [2,2]},
    {"D": 10205, "t": 3, "h_narrow": 4, "h_ordinary": 4, "rank2": 2, "rank4_form": 0, "rank4_link": 0, "match": true, "pell_neg": true, "invariants": [2,2]},
    {"D": 11245, "t": 3, "h_narrow": 4, "h_ordinary": 4, "rank2": 2, "rank4_form": 0, "rank4_link": 0, "match": true, "pell_neg": true, "invariants": [2,2]},
    {"D": 11765, "t": 3, "h_narrow": 8, "h_ordinary": 4, "rank2": 2, "rank4_form": 1, "rank4_link": 1, "match": true, "pell_neg": false, "invariants": [2,4]},
    {"D": 12545, "t": 3, "h_narrow": 20, "h_ordinary": 20, "rank2": 2, "rank4_form": 0, "rank4_link": 0, "match": true, "pell_neg": true, "invariants": [2,10]},
    {"D": 12805, "t": 3, "h_narrow": 4, "h_ordinary": 4, "rank2": 2, "rank4_form": 0, "rank4_link": 0, "match": true, "pell_neg": true, "invariants": [2,2]},
    {"D": 85, "t": 2, "h_narrow": 2, "h_ordinary": 2, "rank2": 1, "rank4_form": 0, "rank4_link": 0, "match": true, "pell_neg": true, "invariants": [2]},
    {"D": 2465, "t": 3, "h_narrow": 4, "h_ordinary": 4, "rank2": 2, "rank4_form": 0, "rank4_link": 0, "match": true, "pell_neg": true, "invariants": [2,2]},
    {"D": 3145, "t": 3, "h_narrow": 4, "h_ordinary": 4, "rank2": 2, "rank4_form": 0, "rank4_link": 0, "match": true, "pell_neg": true, "invariants": [2,2]},
    {"D": 3485, "t": 3, "h_narrow": 4, "h_ordinary": 4, "rank2": 2, "rank4_form": 0, "rank4_link": 0, "match": true, "pell_neg": true, "invariants": [2,2]},
    {"D": 4505, "t": 3, "h_narrow": 4, "h_ordinary": 4, "rank2": 2, "rank4_form": 0, "rank4_link": 0, "match": true, "pell_neg": true, "invariants": [2,2]},
    {"D": 5185, "t": 3, "h_narrow": 20, "h_ordinary": 20, "rank2": 2, "rank4_form": 0, "rank4_link": 0, "match": true, "pell_neg": true, "invariants": [2,10]},
    {"D": 6205, "t": 3, "h_narrow": 4, "h_ordinary": 4, "rank2": 2, "rank4_form": 0, "rank4_link": 0, "match": true, "pell_neg": true, "invariants": [2,2]},
    {"D": 7565, "t": 3, "h_narrow": 8, "h_ordinary": 4, "rank2": 2, "rank4_form": 1, "rank4_link": 1, "match": true, "pell_neg": false, "invariants": [2,4]},
    {"D": 8245, "t": 3, "h_narrow": 4, "h_ordinary": 4, "rank2": 2, "rank4_form": 0, "rank4_link": 0, "match": true, "pell_neg": true, "invariants": [2,2]},
    {"D": 8585, "t": 3, "h_narrow": 8, "h_ordinary": 4, "rank2": 2, "rank4_form": 1, "rank4_link": 1, "match": true, "pell_neg": false, "invariants": [2,4]},
    {"D": 9265, "t": 3, "h_narrow": 4, "h_ordinary": 4, "rank2": 2, "rank4_form": 0, "rank4_link": 0, "match": true, "pell_neg": true, "invariants": [2,2]},
    {"D": 9605, "t": 3, "h_narrow": 4, "h_ordinary": 4, "rank2": 2, "rank4_form": 0, "rank4_link": 0, "match": true, "pell_neg": true, "invariants": [2,2]},
    {"D": 11645, "t": 3, "h_narrow": 4, "h_ordinary": 4, "rank2": 2, "rank4_form": 0, "rank4_link": 0, "match": true, "pell_neg": true, "invariants": [2,2]},
    {"D": 12665, "t": 3, "h_narrow": 8, "h_ordinary": 4, "rank2": 2, "rank4_form": 1, "rank4_link": 1, "match": true, "pell_neg": false, "invariants": [2,4]},
    {"D": 13345, "t": 3, "h_narrow": 4, "h_ordinary": 4, "rank2": 2, "rank4_form": 0, "rank4_link": 0, "match": true, "pell_neg": true, "invariants": [2,2]},
    {"D": 14705, "t": 3, "h_narrow": 4, "h_ordinary": 4, "rank2": 2, "rank4_form": 0, "rank4_link": 0, "match": true, "pell_neg": true, "invariants": [2,2]},
    {"D": 15385, "t": 3, "h_narrow": 4, "h_ordinary": 4, "rank2": 2, "rank4_form": 0, "rank4_link": 0, "match": true, "pell_neg": true, "invariants": [2,2]},
    {"D": 16405, "t": 3, "h_narrow": 4, "h_ordinary": 4, "rank2": 2, "rank4_form": 0, "rank4_link": 0, "match": true, "pell_neg": true, "invariants": [2,2]},
    {"D": 16745, "t": 3, "h_narrow": 4, "h_ordinary": 4, "rank2": 2, "rank4_form": 0, "rank4_link": 0, "match": true, "pell_neg": true, "invariants": [2,2]},
    {"D": 145, "t": 2, "h_narrow": 4, "h_ordinary": 4, "rank2": 1, "rank4_form": 1, "rank4_link": 1, "match": true, "pell_neg": true, "invariants": [4]},
    {"D": 5365, "t": 3, "h_narrow": 4, "h_ordinary": 4, "rank2": 2, "rank4_form": 0, "rank4_link": 0, "match": true, "pell_neg": true, "invariants": [2,2]},
    {"D": 5945, "t": 3, "h_narrow": 8, "h_ordinary": 4, "rank2": 2, "rank4_form": 1, "rank4_link": 1, "match": true, "pell_neg": false, "invariants": [2,4]},
    {"D": 7685, "t": 3, "h_narrow": 8, "h_ordinary": 4, "rank2": 2, "rank4_form": 1, "rank4_link": 1, "match": true, "pell_neg": false, "invariants": [2,4]},
    {"D": 8845, "t": 3, "h_narrow": 8, "h_ordinary": 4, "rank2": 2, "rank4_form": 1, "rank4_link": 1, "match": true, "pell_neg": false, "invariants": [2,4]},
    {"D": 10585, "t": 3, "h_narrow": 4, "h_ordinary": 4, "rank2": 2, "rank4_form": 0, "rank4_link": 0, "match": true, "pell_neg": true, "invariants": [2,2]},
    {"D": 12905, "t": 3, "h_narrow": 16, "h_ordinary": 16, "rank2": 2, "rank4_form": 1, "rank4_link": 1, "match": true, "pell_neg": true, "invariants": [2,8]},
    {"D": 14065, "t": 3, "h_narrow": 4, "h_ordinary": 4, "rank2": 2, "rank4_form": 0, "rank4_link": 0, "match": true, "pell_neg": true, "invariants": [2,2]},
    {"D": 14645, "t": 3, "h_narrow": 8, "h_ordinary": 8, "rank2": 2, "rank4_form": 1, "rank4_link": 1, "match": true, "pell_neg": true, "invariants": [2,4]},
    {"D": 15805, "t": 3, "h_narrow": 16, "h_ordinary": 8, "rank2": 2, "rank4_form": 2, "rank4_link": 2, "match": true, "pell_neg": false, "invariants": [4,4]},
    {"D": 16385, "t": 3, "h_narrow": 12, "h_ordinary": 12, "rank2": 2, "rank4_form": 0, "rank4_link": 0, "match": true, "pell_neg": true, "invariants": [2,6]},
    {"D": 19865, "t": 3, "h_narrow": 4, "h_ordinary": 4, "rank2": 2, "rank4_form": 0, "rank4_link": 0, "match": true, "pell_neg": true, "invariants": [2,2]},
    {"D": 185, "t": 2, "h_narrow": 2, "h_ordinary": 2, "rank2": 1, "rank4_form": 0, "rank4_link": 0, "match": true, "pell_neg": true, "invariants": [2]},
    {"D": 7585, "t": 3, "h_narrow": 8, "h_ordinary": 8, "rank2": 2, "rank4_form": 1, "rank4_link": 1, "match": true, "pell_neg": true, "invariants": [2,4]},
    {"D": 9805, "t": 3, "h_narrow": 12, "h_ordinary": 12, "rank2": 2, "rank4_form": 0, "rank4_link": 0, "match": true, "pell_neg": true, "invariants": [2,6]},
    {"D": 11285, "t": 3, "h_narrow": 4, "h_ordinary": 4, "rank2": 2, "rank4_form": 0, "rank4_link": 0, "match": true, "pell_neg": true, "invariants": [2,2]},
    {"D": 13505, "t": 3, "h_narrow": 4, "h_ordinary": 4, "rank2": 2, "rank4_form": 0, "rank4_link": 0, "match": true, "pell_neg": true, "invariants": [2,2]},
    {"D": 16465, "t": 3, "h_narrow": 4, "h_ordinary": 4, "rank2": 2, "rank4_form": 0, "rank4_link": 0, "match": true, "pell_neg": true, "invariants": [2,2]},
    {"D": 17945, "t": 3, "h_narrow": 4, "h_ordinary": 4, "rank2": 2, "rank4_form": 0, "rank4_link": 0, "match": true, "pell_neg": true, "invariants": [2,2]},
    {"D": 18685, "t": 3, "h_narrow": 8, "h_ordinary": 4, "rank2": 2, "rank4_form": 1, "rank4_link": 1, "match": true, "pell_neg": false, "invariants": [2,4]},
    {"D": 205, "t": 2, "h_narrow": 4, "h_ordinary": 2, "rank2": 1, "rank4_form": 1, "rank4_link": 1, "match": true, "pell_neg": false, "invariants": [4]},